id,set,set_id,type,title,level,question_text,definition,sentence,opt1,opt2,opt3,opt4,correct_answer,explanation,example1,example2,example3,example4,usage1,tip
677,"Verbs - Present & Past Tenses",34,deep_dive,"FROLIC /frólik/ BRINCAR (saltitar)",Intermediate,,"To play happily \br regular \br frolic; frolicked; frolicked",,,,,,,,"Lambs frolic in the field. \br The children frolicked in the snow. \br They have frolicked all afternoon.","Lambs frolic in the field. \br The children frolicked in the snow. \br They have frolicked all afternoon.",,,,
678,"Verbs - Present & Past Tenses",34,deep_dive,"TRAVEL /trével/ VIAJAR",Beginner,,"To go on a journey \br regular \br travel; travelled; travelled",,,,,,,,"I travel by train. \br She travelled to Italy. \br He has travelled a lot.","I travel by train. \br She travelled to Italy. \br He has travelled a lot.",,,,
679,"Verbs - Present & Past Tenses",34,deep_dive,"CANCEL /kénsel/ CANCELAR",Beginner,,"To call off \br regular \br cancel; cancelled; cancelled",,,,,,,,"They cancel the show. \br The flight was cancelled. \br The event has been cancelled.","They cancel the show. \br The flight was cancelled. \br The event has been cancelled.",,,,
680,"Verbs - Present & Past Tenses",34,deep_dive,"MARVEL /márvel/ MARAVILHAR-SE",Intermediate,,"To be filled with wonder \br regular \br marvel; marvelled; marvelled",,,,,,,,"We marvel at the view. \br He marvelled at the stars. \br She has marvelled at nature since childhood.","We marvel at the view. \br He marvelled at the stars. \br She has marvelled at nature since childhood.",,,,
681,"Verbs - Present & Past Tenses",34,deep_dive,"MODEL /módel/ MODELAR",Intermediate,,"To display or shape \br regular \br model; modelled; modelled",,,,,,,,"She models dresses. \br He modelled for a painter. \br The statue has been modelled in clay.","She models dresses. \br He modelled for a painter. \br The statue has been modelled in clay.",,,,
682,"Verbs - Present & Past Tenses",34,deep_dive,"SIGNAL /sígnel/ SINALIZAR",Intermediate,,"To give a sign \br regular \br signal; signalled; signalled",,,,,,,,"The guard signals to stop. \br The driver signalled left. \br A change has been signalled.","The guard signals to stop. \br The driver signalled left. \br A change has been signalled.",,,,
683,"Verbs - Present & Past Tenses",34,deep_dive,"DIAL /dáial/ DISCAR",Intermediate,,"To press numbers on a phone \br regular \br dial; dialled; dialled",,,,,,,,"I dial the number. \br He dialled the wrong extension. \br She has already dialled.","I dial the number. \br He dialled the wrong extension. \br She has already dialled.",,,,
684,"Verbs - Present & Past Tenses",34,deep_dive,"LABEL /lêibel/ ROTULAR",Intermediate,,"To attach a tag \br regular \br label; labelled; labelled",,,,,,,,"I label the boxes. \br She labelled the jars. \br All the files have been labelled.","I label the boxes. \br She labelled the jars. \br All the files have been labelled.",,,,
685,"Verbs - Present & Past Tenses",34,deep_dive,"FUEL /fiúel/ ABASTECER",Intermediate,,"To supply energy \br regular \br fuel; fuelled; fuelled",,,,,,,,"Petrol fuels the car. \br The news fuelled their anger. \br The fire has been fuelled by wind.","Petrol fuels the car. \br The news fuelled their anger. \br The fire has been fuelled by wind.",,,,
686,"Verbs - Present & Past Tenses",34,deep_dive,"BE /uóz",Beginner,,A1,,,,,,,,"To exist or have a quality \br irregular \br be; was/were; been","To exist or have a quality \br irregular \br be; was/were; been",,,,"I am a student. \br She was tired. \br I have never been to Paris."
687,"Verbs - Present & Past Tenses",34,deep_dive,"HAVE /héd/ TER",Beginner,,"To possess \br irregular \br have; had; had",,,,,,,,"I have a cat. \br He had a cold. \br She has had breakfast.","I have a cat. \br He had a cold. \br She has had breakfast.",,,,
688,"Verbs - Present & Past Tenses",34,deep_dive,"DO /díd/ FAZER",Beginner,,"To perform an action \br irregular \br do; did; done",,,,,,,,"I do my homework. \br He did the dishes. \br She has done a great job.","I do my homework. \br He did the dishes. \br She has done a great job.",,,,
689,"Verbs - Present & Past Tenses",34,deep_dive,"SAY /séd/ DIZER",Beginner,,"To speak words \br irregular \br say; said; said",,,,,,,,"I say hello. \br She said nothing. \br He has said too much.","I say hello. \br She said nothing. \br He has said too much.",,,,
690,"Verbs - Present & Past Tenses",34,deep_dive,"GO /uént/ IR",Beginner,,"To move from one place to another \br irregular \br go; went; gone",,,,,,,,"I go to school. \br We went to the park. \br She has gone home.","I go to school. \br We went to the park. \br She has gone home.",,,,
691,"Verbs - Present & Past Tenses",34,deep_dive,"GET /gót/ OBTER/ PEGAR",Beginner,,"To receive or obtain \br irregular \br get; got; got/gotten",,,,,,,,"I get up at seven. \br He got a letter. \br I have got a present.","I get up at seven. \br He got a letter. \br I have got a present.",,,,
692,"Verbs - Present & Past Tenses",34,deep_dive,"MAKE /mêid/ FAZER",Beginner,,"To create or produce \br irregular \br make; made; made",,,,,,,,"I make coffee. \br She made a cake. \br It has been made of wood.","I make coffee. \br She made a cake. \br It has been made of wood.",,,,
693,"Verbs - Present & Past Tenses",34,deep_dive,"KNOW /niú/ SABER/ CONHECER",Beginner,,"To have information \br irregular \br know; knew; known",,,,,,,,"I know the answer. \br He knew her name. \br She has known him for years.","I know the answer. \br He knew her name. \br She has known him for years.",,,,
694,"Verbs - Present & Past Tenses",34,deep_dive,"THINK /fóot/ PENSAR",Beginner,,"To have an opinion \br irregular \br think; thought; thought",,,,,,,,"I think it's good. \br She thought about it. \br He has thought of a plan.","I think it's good. \br She thought about it. \br He has thought of a plan.",,,,
695,"Verbs - Present & Past Tenses",34,deep_dive,"TAKE /túk/ PEGAR/ LEVAR",Beginner,,"To hold or carry \br irregular \br take; took; taken",,,,,,,,"I take the bus. \br He took a photo. \br The seat has been taken.","I take the bus. \br He took a photo. \br The seat has been taken.",,,,
696,"Verbs - Present & Past Tenses",34,deep_dive,"SEE /sóo/ VER",Beginner,,"To notice with eyes \br irregular \br see; saw; seen",,,,,,,,"I see a bird. \br We saw a film. \br I have never seen snow.","I see a bird. \br We saw a film. \br I have never seen snow.",,,,
697,"Verbs - Present & Past Tenses",34,deep_dive,"COME /kêim/ VIR",Beginner,,"To move toward the speaker \br irregular \br come; came; come",,,,,,,,"Come here. \br She came late. \br The guests have come.","Come here. \br She came late. \br The guests have come.",,,,
