id,set,set_id,type,title,level,question_text,definition,sentence,opt1,opt2,opt3,opt4,correct_answer,explanation,example1,example2,example3,example4,usage1,tip
598,"Verbs - Present & Past Tenses",34,deep_dive,"LOVE /lûv/ AMAR",Beginner,,"To have strong affection for someone or something \br regular \br love; loved; loved",,,,,,,,"I love my dog. \br She loved the film. \br She has loved that song for years.","I love my dog. \br She loved the film. \br She has loved that song for years.",,,,
599,"Verbs - Present & Past Tenses",34,deep_dive,"BAKE /bêik/ ASSAR",Beginner,,"To cook in an oven using dry heat \br regular \br bake; baked; baked",,,,,,,,"I bake cookies. \br He baked a cake. \br He has baked three pies.","I bake cookies. \br He baked a cake. \br He has baked three pies.",,,,
600,"Verbs - Present & Past Tenses",34,deep_dive,"SMILE /smáil/ SORRIR",Beginner,,"To turn up the corners of your mouth to show happiness \br regular \br smile; smiled; smiled",,,,,,,,"You smile every day. \br The baby smiled at me. \br She has never smiled like that.","You smile every day. \br The baby smiled at me. \br She has never smiled like that.",,,,
601,"Verbs - Present & Past Tenses",34,deep_dive,"HOPE /hôup/ ESPERAR",Beginner,,"To want something to happen \br regular \br hope; hoped; hoped",,,,,,,,"I hope you are well. \br We hoped for sun. \br They had hoped to come.","I hope you are well. \br We hoped for sun. \br They had hoped to come.",,,,
602,"Verbs - Present & Past Tenses",34,deep_dive,"LIKE /láik/ GOSTAR",Beginner,,"To find something pleasant \br regular \br like; liked; liked",,,,,,,,"I like pizza. \br He liked the book. \br She has always liked cats.","I like pizza. \br He liked the book. \br She has always liked cats.",,,,
603,"Verbs - Present & Past Tenses",34,deep_dive,"DANCE /dæns/ DANÇAR",Beginner,,"To move your body to music \br regular \br dance; danced; danced",,,,,,,,"We dance on Fridays. \br They danced all night. \br I have never danced salsa.","We dance on Fridays. \br They danced all night. \br I have never danced salsa.",,,,
604,"Verbs - Present & Past Tenses",34,deep_dive,"LIVE /lîv/ VIVER",Beginner,,"To have your home in a place \br regular \br live; lived; lived",,,,,,,,"They live in London. \br She lived in Paris. \br He has lived here for ten years.","They live in London. \br She lived in Paris. \br He has lived here for ten years.",,,,
605,"Verbs - Present & Past Tenses",34,deep_dive,"SAVE /sêiv/ SALVAR",Beginner,,"To keep from harm or for later \br regular \br save; saved; saved",,,,,,,,"I save money. \br He saved my life. \br We have saved enough.","I save money. \br He saved my life. \br We have saved enough.",,,,
606,"Verbs - Present & Past Tenses",34,deep_dive,"USE /iúz/ USAR",Beginner,,"To do something with a tool or method \br regular \br use; used; used",,,,,,,,"I use a pen. \br She used my phone. \br The car has been used a lot.","I use a pen. \br She used my phone. \br The car has been used a lot.",,,,
607,"Verbs - Present & Past Tenses",34,deep_dive,"CARE /kér/ CUIDAR",Beginner,,"To feel concern or interest \br regular \br care; cared; cared",,,,,,,,"I care about you. \br He cared for his plant. \br She has always cared for animals.","I care about you. \br He cared for his plant. \br She has always cared for animals.",,,,
608,"Verbs - Present & Past Tenses",34,deep_dive,"HATE /hêit/ ODIAR",Beginner,,"To strongly dislike \br regular \br hate; hated; hated",,,,,,,,"I hate spiders. \br She hated the soup. \br He has hated mornings since childhood.","I hate spiders. \br She hated the soup. \br He has hated mornings since childhood.",,,,
609,"Verbs - Present & Past Tenses",34,deep_dive,"CHANGE /tchêindj/ MUDAR",Beginner,,"To become different \br regular \br change; changed; changed",,,,,,,,"I change my mind. \br He changed jobs. \br The world has changed.","I change my mind. \br He changed jobs. \br The world has changed.",,,,
610,"Verbs - Present & Past Tenses",34,deep_dive,"CLOSE /klôuz/ FECHAR",Beginner,,"To shut \br regular \br close; closed; closed",,,,,,,,"I close the door. \br She closed the window. \br The shop has closed early.","I close the door. \br She closed the window. \br The shop has closed early.",,,,
611,"Verbs - Present & Past Tenses",34,deep_dive,"MOVE /mûuv/ MOVER",Beginner,,"To change position or place \br regular \br move; moved; moved",,,,,,,,"We move house often. \br They moved to Spain. \br She has moved again.","We move house often. \br They moved to Spain. \br She has moved again.",,,,
612,"Verbs - Present & Past Tenses",34,deep_dive,"ARRIVE /aráiv/ CHEGAR",Beginner,,"To reach a place \br regular \br arrive; arrived; arrived",,,,,,,,"I arrive at 8 am. \br He arrived late. \br The letter has arrived.","I arrive at 8 am. \br He arrived late. \br The letter has arrived.",,,,
613,"Verbs - Present & Past Tenses",34,deep_dive,"NEED /nîid/ PRECISAR",Beginner,,"To require something \br regular \br need; needed; needed",,,,,,,,"I need water. \br He needed a break. \br She has always needed help.","I need water. \br He needed a break. \br She has always needed help.",,,,
614,"Verbs - Present & Past Tenses",34,deep_dive,"SEEM /sîim/ PARECER",Beginner,,"To appear to be \br regular \br seem; seemed; seemed",,,,,,,,"You seem happy. \br It seemed easy. \br It has never seemed possible.","You seem happy. \br It seemed easy. \br It has never seemed possible.",,,,
615,"Verbs - Present & Past Tenses",34,deep_dive,"WORK /uêrk/ TRABALHAR",Beginner,,"To do a job or activity \br regular \br work; worked; worked",,,,,,,,"I work in a café. \br She worked late. \br He has worked here for years.","I work in a café. \br She worked late. \br He has worked here for years.",,,,
616,"Verbs - Present & Past Tenses",34,deep_dive,"ASK /æsk/ PERGUNTAR",Beginner,,"To put a question \br regular \br ask; asked; asked",,,,,,,,"I ask many questions. \br He asked for directions. \br She has asked me before.","I ask many questions. \br He asked for directions. \br She has asked me before.",,,,
617,"Verbs - Present & Past Tenses",34,deep_dive,"CALL /kóol/ CHAMAR",Beginner,,"To phone or shout for someone \br regular \br call; called; called",,,,,,,,"I call my mum. \br She called a taxi. \br He hasn't called yet.","I call my mum. \br She called a taxi. \br He hasn't called yet.",,,,
618,"Verbs - Present & Past Tenses",34,deep_dive,"HELP /hélp/ AJUDAR",Beginner,,"To assist someone \br regular \br help; helped; helped",,,,,,,,"I help my friends. \br He helped me cook. \br She has helped a lot of people.","I help my friends. \br He helped me cook. \br She has helped a lot of people.",,,,
619,"Verbs - Present & Past Tenses",34,deep_dive,"START /stárt/ COMEÇAR",Beginner,,"To begin \br regular \br start; started; started",,,,,,,,"We start at nine. \br The film started at seven. \br School has already started.","We start at nine. \br The film started at seven. \br School has already started.",,,,
620,"Verbs - Present & Past Tenses",34,deep_dive,"FOLLOW /fálou/ SEGUIR",Beginner,,"To go behind or obey \br regular \br follow; followed; followed",,,,,,,,"I follow the rules. \br The dog followed me home. \br She has followed me for years.","I follow the rules. \br The dog followed me home. \br She has followed me for years.",,,,
621,"Verbs - Present & Past Tenses",34,deep_dive,"REMAIN /rimêin/ PERMANECER",Intermediate,,"To stay in the same place or condition \br regular \br remain; remained; remained",,,,,,,,"I remain calm. \br He remained silent. \br Nothing has remained the same.","I remain calm. \br He remained silent. \br Nothing has remained the same.",,,,
622,"Verbs - Present & Past Tenses",34,deep_dive,"OFFER /ófer/ OFERECER",Beginner,,"To give or present something \br regular \br offer; offered; offered",,,,,,,,"I offer my seat. \br She offered to help. \br He has never offered advice.","I offer my seat. \br She offered to help. \br He has never offered advice.",,,,
623,"Verbs - Present & Past Tenses",34,deep_dive,"REMEMBER /rimémber/ LEMBRAR",Beginner,,"To not forget \br regular \br remember; remembered; remembered",,,,,,,,"I remember your name. \br He remembered the date. \br She has always remembered my birthday.","I remember your name. \br He remembered the date. \br She has always remembered my birthday.",,,,
624,"Verbs - Present & Past Tenses",34,deep_dive,"PULL /púl/ PUXAR",Beginner,,"To move something towards you \br regular \br pull; pulled; pulled",,,,,,,,"I pull the rope. \br She pulled the door. \br The cart has been pulled away.","I pull the rope. \br She pulled the door. \br The cart has been pulled away.",,,,
625,"Verbs - Present & Past Tenses",34,deep_dive,"PUSH /púsh/ EMPURRAR",Beginner,,"To move something away from you \br regular \br push; pushed; pushed",,,,,,,,"I push the button. \br He pushed the trolley. \br The door has been pushed open.","I push the button. \br He pushed the trolley. \br The door has been pushed open.",,,,
626,"Verbs - Present & Past Tenses",34,deep_dive,"WAIT /uêit/ ESPERAR",Beginner,,"To stay until something happens \br regular \br wait; waited; waited",,,,,,,,"I wait for the bus. \br We waited an hour. \br She has waited long enough.","I wait for the bus. \br We waited an hour. \br She has waited long enough.",,,,
627,"Verbs - Present & Past Tenses",34,deep_dive,"EXPECT /ikspéct/ ESPERAR (aguardar)",Beginner,,"To believe something will happen \br regular \br expect; expected; expected",,,,,,,,"I expect good news. \br They expected rain. \br The results have been expected.","I expect good news. \br They expected rain. \br The results have been expected.",,,,
628,"Verbs - Present & Past Tenses",34,deep_dive,"CARRY /kéri/ CARREGAR",Beginner,,"To hold and move something \br regular \br carry; carried; carried",,,,,,,,"I carry a bag. \br He carried the box. \br The message has been carried.","I carry a bag. \br He carried the box. \br The message has been carried.",,,,
629,"Verbs - Present & Past Tenses",34,deep_dive,"TRY /trái/ TENTAR",Beginner,,"To attempt \br regular \br try; tried; tried",,,,,,,,"I try my best. \br She tried to call. \br He has tried sushi once.","I try my best. \br She tried to call. \br He has tried sushi once.",,,,
630,"Verbs - Present & Past Tenses",34,deep_dive,"STUDY /stôdi/ ESTUDAR",Beginner,,"To learn about a subject \br regular \br study; studied; studied",,,,,,,,"I study English. \br They studied all night. \br She has studied French.","I study English. \br They studied all night. \br She has studied French.",,,,
631,"Verbs - Present & Past Tenses",34,deep_dive,"CRY /krái/ CHORAR",Beginner,,"To produce tears from sadness \br regular \br cry; cried; cried",,,,,,,,"The baby cries. \br She cried at the film. \br I have never cried like that.","The baby cries. \br She cried at the film. \br I have never cried like that.",,,,
632,"Verbs - Present & Past Tenses",34,deep_dive,"FRY /frái/ FRITAR",Intermediate,,"To cook in hot oil \br regular \br fry; fried; fried",,,,,,,,"I fry eggs. \br He fried the fish. \br The onions have been fried.","I fry eggs. \br He fried the fish. \br The onions have been fried.",,,,
633,"Verbs - Present & Past Tenses",34,deep_dive,"APPLY /aplái/ CANDIDATAR-SE",Intermediate,,"To make a formal request \br regular \br apply; applied; applied",,,,,,,,"I apply for jobs. \br She applied yesterday. \br He has applied three times.","I apply for jobs. \br She applied yesterday. \br He has applied three times.",,,,
634,"Verbs - Present & Past Tenses",34,deep_dive,"REPLY /riplái/ RESPONDER",Beginner,,"To answer \br regular \br reply; replied; replied",,,,,,,,"I reply to emails. \br He replied quickly. \br She hasn't replied yet.","I reply to emails. \br He replied quickly. \br She hasn't replied yet.",,,,
635,"Verbs - Present & Past Tenses",34,deep_dive,"DENY /dinái/ NEGAR",Intermediate,,"To say something is not true \br regular \br deny; denied; denied",,,,,,,,"I deny the rumour. \br She denied everything. \br The request has been denied.","I deny the rumour. \br She denied everything. \br The request has been denied.",,,,
636,"Verbs - Present & Past Tenses",34,deep_dive,"SPY /spái/ ESPIAR",Intermediate,,"To watch secretly \br regular \br spy; spied; spied",,,,,,,,"The cat spies on birds. \br She spied on her brother. \br Someone has been spied on.","The cat spies on birds. \br She spied on her brother. \br Someone has been spied on.",,,,
637,"Verbs - Present & Past Tenses",34,deep_dive,"RELY /rilái/ CONFIAR",Intermediate,,"To depend on \br regular \br rely; relied; relied",,,,,,,,"I rely on you. \br He relied on the map. \br She has always relied on luck.","I rely on you. \br He relied on the map. \br She has always relied on luck.",,,,
638,"Verbs - Present & Past Tenses",34,deep_dive,"SUPPLY /soplái/ FORNECER",Intermediate,,"To provide something needed \br regular \br supply; supplied; supplied",,,,,,,,"They supply water. \br The company supplied chairs. \br The goods have been supplied.","They supply water. \br The company supplied chairs. \br The goods have been supplied.",,,,
639,"Verbs - Present & Past Tenses",34,deep_dive,"WORRY /uôri/ PREOCUPAR-SE",Beginner,,"To feel anxious about something \br regular \br worry; worried; worried",,,,,,,,"I worry about exams. \br He worried all night. \br She has worried enough.","I worry about exams. \br He worried all night. \br She has worried enough.",,,,
640,"Verbs - Present & Past Tenses",34,deep_dive,"MARRY /méri/ CASAR-SE",Beginner,,"To become husband and wife \br regular \br marry; married; married",,,,,,,,"They marry in spring. \br She married Tom. \br They have been married for ten years.","They marry in spring. \br She married Tom. \br They have been married for ten years.",,,,
641,"Verbs - Present & Past Tenses",34,deep_dive,"HURRY /hôri/ APRESSAR-SE",Intermediate,,"To move or do something quickly \br regular \br hurry; hurried; hurried",,,,,,,,"I hurry to school. \br He hurried out. \br She has hurried through breakfast.","I hurry to school. \br He hurried out. \br She has hurried through breakfast.",,,,
642,"Verbs - Present & Past Tenses",34,deep_dive,"COPY /kópi/ COPIAR",Beginner,,"To replicate something \br regular \br copy; copied; copied",,,,,,,,"I copy the notes. \br He copied my answer. \br The file has been copied.","I copy the notes. \br He copied my answer. \br The file has been copied.",,,,
643,"Verbs - Present & Past Tenses",34,deep_dive,"PLAY /plêi/ JOGAR/ TOCAR",Beginner,,"To take part in a game or produce music \br regular \br play; played; played",,,,,,,,"I play tennis. \br We played cards. \br She has played piano since she was six.","I play tennis. \br We played cards. \br She has played piano since she was six.",,,,
644,"Verbs - Present & Past Tenses",34,deep_dive,"ENJOY /indjói/ APROVEITAR",Beginner,,"To take pleasure in \br regular \br enjoy; enjoyed; enjoyed",,,,,,,,"I enjoy music. \br He enjoyed the party. \br They have always enjoyed hiking.","I enjoy music. \br He enjoyed the party. \br They have always enjoyed hiking.",,,,
645,"Verbs - Present & Past Tenses",34,deep_dive,"STAY /stêi/ FICAR",Beginner,,"To remain in a place \br regular \br stay; stayed; stayed",,,,,,,,"I stay at home. \br She stayed with a friend. \br We have stayed here before.","I stay at home. \br She stayed with a friend. \br We have stayed here before.",,,,
646,"Verbs - Present & Past Tenses",34,deep_dive,"DESTROY /distrói/ DESTRUIR",Intermediate,,"To damage so badly it no longer exists \br regular \br destroy; destroyed; destroyed",,,,,,,,"Fire destroys forests. \br The storm destroyed the house. \br The letter has been destroyed.","Fire destroys forests. \br The storm destroyed the house. \br The letter has been destroyed.",,,,
647,"Verbs - Present & Past Tenses",34,deep_dive,"OBEY /obêi/ OBEDECER",Intermediate,,"To follow orders \br regular \br obey; obeyed; obeyed",,,,,,,,"You must obey the law. \br The dog obeyed. \br The rules have been obeyed.","You must obey the law. \br The dog obeyed. \br The rules have been obeyed.",,,,
648,"Verbs - Present & Past Tenses",34,deep_dive,"ANNOY /anói/ IRRITAR",Intermediate,,"To make someone slightly angry \br regular \br annoy; annoyed; annoyed",,,,,,,,"Loud noise annoys me. \br He annoyed his sister. \br I have never been so annoyed.","Loud noise annoys me. \br He annoyed his sister. \br I have never been so annoyed.",,,,
649,"Verbs - Present & Past Tenses",34,deep_dive,"DELAY /dilêi/ ATRASAR",Intermediate,,"To make something happen later \br regular \br delay; delayed; delayed",,,,,,,,"We delay the meeting. \br The flight was delayed. \br The train has been delayed again.","We delay the meeting. \br The flight was delayed. \br The train has been delayed again.",,,,
650,"Verbs - Present & Past Tenses",34,deep_dive,"DECAY /dikêi/ DECAIR",Intermediate,,"To rot or break down \br regular \br decay; decayed; decayed",,,,,,,,"Teeth decay without care. \br The fruit decayed. \br The wood has decayed.","Teeth decay without care. \br The fruit decayed. \br The wood has decayed.",,,,
651,"Verbs - Present & Past Tenses",34,deep_dive,"BETRAY /bitrêi/ TRAIR",Intermediate,,"To be disloyal \br regular \br betray; betrayed; betrayed",,,,,,,,"She betrays no emotion. \br He betrayed his friend. \br I have never betrayed anyone.","She betrays no emotion. \br He betrayed his friend. \br I have never betrayed anyone.",,,,
652,"Verbs - Present & Past Tenses",34,deep_dive,"EMPLOY /emplói/ EMPREGAR",Intermediate,,"To pay someone to work \br regular \br employ; employed; employed",,,,,,,,"The firm employs ten people. \br They employed a new chef. \br She has been employed since 2020.","The firm employs ten people. \br They employed a new chef. \br She has been employed since 2020.",,,,
653,"Verbs - Present & Past Tenses",34,deep_dive,"SURVEY /sûrvêi/ INSPECIONAR",Intermediate,,"To examine or look at everything \br regular \br survey; surveyed; surveyed",,,,,,,,"We survey the land. \br They surveyed the damage. \br The area has been surveyed.","We survey the land. \br They surveyed the damage. \br The area has been surveyed.",,,,
654,"Verbs - Present & Past Tenses",34,deep_dive,"PRAY /prêi/ REZAR",Intermediate,,"To speak to God \br regular \br pray; prayed; prayed",,,,,,,,"I pray every evening. \br She prayed for peace. \br They have prayed together.","I pray every evening. \br She prayed for peace. \br They have prayed together.",,,,
655,"Verbs - Present & Past Tenses",34,deep_dive,"SWAY /suêi/ BALANÇAR",Intermediate,,"To move slowly side to side \br regular \br sway; swayed; swayed",,,,,,,,"The trees sway in the wind. \br The dancer swayed. \br He has never swayed from his beliefs.","The trees sway in the wind. \br The dancer swayed. \br He has never swayed from his beliefs.",,,,
656,"Verbs - Present & Past Tenses",34,deep_dive,"SPRAY /sprêi/ BORRIFAR",Intermediate,,"To send liquid in small drops \br regular \br spray; sprayed; sprayed",,,,,,,,"I spray water on the plants. \br He sprayed paint on the wall. \br The crops have been sprayed.","I spray water on the plants. \br He sprayed paint on the wall. \br The crops have been sprayed.",,,,
657,"Verbs - Present & Past Tenses",34,deep_dive,"CONVEY /konvêi/ TRANSMITIR",Intermediate,,"To communicate an idea or feeling \br regular \br convey; conveyed; conveyed",,,,,,,,"Words convey feelings. \br She conveyed her thanks. \br The message has been conveyed.","Words convey feelings. \br She conveyed her thanks. \br The message has been conveyed.",,,,
658,"Verbs - Present & Past Tenses",34,deep_dive,"STOP /stóp/ PARAR",Beginner,,"To cease movement \br regular \br stop; stopped; stopped",,,,,,,,"I stop at the red light. \br He stopped the car. \br The game has been stopped.","I stop at the red light. \br He stopped the car. \br The game has been stopped.",,,,
659,"Verbs - Present & Past Tenses",34,deep_dive,"PLAN /plén/ PLANEJAR",Beginner,,"To arrange in advance \br regular \br plan; planned; planned",,,,,,,,"I plan my week. \br She planned a trip. \br Everything has been planned.","I plan my week. \br She planned a trip. \br Everything has been planned.",,,,
660,"Verbs - Present & Past Tenses",34,deep_dive,"ROB /rób/ ROUBAR",Intermediate,,"To take property illegally \br regular \br rob; robbed; robbed",,,,,,,,"They rob banks. \br Someone robbed the shop. \br The bank has been robbed.","They rob banks. \br Someone robbed the shop. \br The bank has been robbed.",,,,
661,"Verbs - Present & Past Tenses",34,deep_dive,"BEG /bég/ IMPLORAR",Intermediate,,"To ask earnestly \br regular \br beg; begged; begged",,,,,,,,"The dog begs for food. \br He begged for help. \br She has never begged before.","The dog begs for food. \br He begged for help. \br She has never begged before.",,,,
662,"Verbs - Present & Past Tenses",34,deep_dive,"DROP /dróp/ DERRUBAR",Beginner,,"To let fall \br regular \br drop; dropped; dropped",,,,,,,,"I drop my keys. \br He dropped the glass. \br The phone has been dropped.","I drop my keys. \br He dropped the glass. \br The phone has been dropped.",,,,
663,"Verbs - Present & Past Tenses",34,deep_dive,"HOP /hóp/ PULAR (um pé)",Intermediate,,"To jump on one foot \br regular \br hop; hopped; hopped",,,,,,,,"Rabbits hop. \br She hopped over the puddle. \br He has hopped on one leg.","Rabbits hop. \br She hopped over the puddle. \br He has hopped on one leg.",,,,
664,"Verbs - Present & Past Tenses",34,deep_dive,"JOG /djóg/ CORRER (leve)",Beginner,,"To run slowly for exercise \br regular \br jog; jogged; jogged",,,,,,,,"I jog every morning. \br We jogged in the park. \br She has jogged five kilometres.","I jog every morning. \br We jogged in the park. \br She has jogged five kilometres.",,,,
665,"Verbs - Present & Past Tenses",34,deep_dive,"HUG /hôg/ ABRAÇAR",Beginner,,"To put arms around someone \br regular \br hug; hugged; hugged",,,,,,,,"I hug my mum. \br He hugged his friend. \br The child has been hugged.","I hug my mum. \br He hugged his friend. \br The child has been hugged.",,,,
666,"Verbs - Present & Past Tenses",34,deep_dive,"PAT /pét/ DAR TAPINHAS",Intermediate,,"To touch lightly with hand \br regular \br pat; patted; patted",,,,,,,,"She pats the dog. \br He patted my shoulder. \br The dog has been patted.","She pats the dog. \br He patted my shoulder. \br The dog has been patted.",,,,
667,"Verbs - Present & Past Tenses",34,deep_dive,"POP /póp/ ESTOURAR",Intermediate,,"To burst with a sound \br regular \br pop; popped; popped",,,,,,,,"Bubbles pop. \br The balloon popped. \br The corn has been popped.","Bubbles pop. \br The balloon popped. \br The corn has been popped.",,,,
668,"Verbs - Present & Past Tenses",34,deep_dive,"RUB /rôb/ ESFREGAR",Intermediate,,"To move hand back and forth \br regular \br rub; rubbed; rubbed",,,,,,,,"I rub my eyes. \br She rubbed her hands. \br The mark has been rubbed off.","I rub my eyes. \br She rubbed her hands. \br The mark has been rubbed off.",,,,
669,"Verbs - Present & Past Tenses",34,deep_dive,"SHIP /shíp/ ENVIAR (carga)",Intermediate,,"To send goods \br regular \br ship; shipped; shipped",,,,,,,,"They ship goods worldwide. \br The order was shipped yesterday. \br The package has been shipped.","They ship goods worldwide. \br The order was shipped yesterday. \br The package has been shipped.",,,,
670,"Verbs - Present & Past Tenses",34,deep_dive,"SLIP /slíp/ ESCORREGAR",Beginner,,"To slide accidentally \br regular \br slip; slipped; slipped",,,,,,,,"Don't slip on ice. \br He slipped and fell. \br She has slipped twice today.","Don't slip on ice. \br He slipped and fell. \br She has slipped twice today.",,,,
671,"Verbs - Present & Past Tenses",34,deep_dive,"TAG /tég/ MARCAR (etiqueta)",Intermediate,,"To attach a label or identify \br regular \br tag; tagged; tagged",,,,,,,,"They tag the animals. \br He tagged me in a photo. \br You have been tagged.","They tag the animals. \br He tagged me in a photo. \br You have been tagged.",,,,
672,"Verbs - Present & Past Tenses",34,deep_dive,"TIP /típ/ INCLINAR/ DAR GORJETA",Intermediate,,"To tilt or give extra money \br regular \br tip; tipped; tipped",,,,,,,,"I tip the waiter. \br She tipped the box. \br The chair has been tipped over.","I tip the waiter. \br She tipped the box. \br The chair has been tipped over.",,,,
673,"Verbs - Present & Past Tenses",34,deep_dive,"PANIC /pénik/ ENTRAR EM PÂNICO",Intermediate,,"To feel sudden fear \br regular \br panic; panicked; panicked",,,,,,,,"I panic in crowds. \br He panicked when the alarm rang. \br She has never panicked before.","I panic in crowds. \br He panicked when the alarm rang. \br She has never panicked before.",,,,
674,"Verbs - Present & Past Tenses",34,deep_dive,"PICNIC /píknik/ FAZER PIQUENIQUE",Beginner,,"To eat outdoors \br regular \br picnic; picnicked; picnicked",,,,,,,,"We often picnic by the lake. \br They picnicked on the beach. \br We have picnicked here many times.","We often picnic by the lake. \br They picnicked on the beach. \br We have picnicked here many times.",,,,
675,"Verbs - Present & Past Tenses",34,deep_dive,"MIMIC /mímik/ IMITAR",Intermediate,,"To copy someone's voice or behaviour \br regular \br mimic; mimicked; mimicked",,,,,,,,"Parrots mimic speech. \br She mimicked the teacher. \br Her accent has been mimicked.","Parrots mimic speech. \br She mimicked the teacher. \br Her accent has been mimicked.",,,,
676,"Verbs - Present & Past Tenses",34,deep_dive,"TRAFFIC /tréfik/ TRAFICAR",Advanced,,"To deal illegally \br regular \br traffic; trafficked; trafficked",,,,,,,,"They traffic stolen goods. \br The gang trafficked drugs. \br Endangered animals have been trafficked.","They traffic stolen goods. \br The gang trafficked drugs. \br Endangered animals have been trafficked.",,,,
